<?xml version="1.0" encoding="UTF-8"?>


<list enabled="true"
	  xmlns:xsi="http://www.w3.org/2001/XMLSchema-instance"
	  xmlns="http://l2j.org"
	  xsi:schemaLocation="http://l2j.org MapRegion.xsd" >

	<!-- Giran Habor -->
	<region name="giran_habor" town="Giran Habor" locId="919" bbs="6">
		<respawnPoint x="46763" y="187041" z="-3451" />
		<respawnPoint x="46471" y="186666" z="-3451" />
		<respawnPoint x="47290" y="186842" z="-3451" />
		<respawnPoint x="47038" y="186506" z="-3451" />
		<respawnPoint x="47684" y="186682" z="-3451" />
		<respawnPoint x="47450" y="186347" z="-3451" />
		<respawnPoint x="48715" y="185873" z="-3451" />
		<respawnPoint x="48363" y="185518" z="-3451" />
		<respawnPoint x="48757" y="185124" z="-3451" />
		<respawnPoint x="49034" y="185512" z="-3451" />
		<respawnPoint x="49033" y="184647" z="-3451" />
		<respawnPoint x="49372" y="185076" z="-3451" />
		<respawnPoint x="46763" y="187041" z="-3451" chaotic="true" />
		<respawnPoint x="46471" y="186666" z="-3451" chaotic="true" />
		<respawnPoint x="47290" y="186842" z="-3451" chaotic="true" />
		<respawnPoint x="47038" y="186506" z="-3451" chaotic="true" />
		<respawnPoint x="47684" y="186682" z="-3451" chaotic="true" />
		<respawnPoint x="47450" y="186347" z="-3451" chaotic="true" />
		<respawnPoint x="48715" y="185873" z="-3451" chaotic="true" />
		<respawnPoint x="48363" y="185518" z="-3451" chaotic="true" />
		<respawnPoint x="48757" y="185124" z="-3451" chaotic="true" />
		<respawnPoint x="49034" y="185512" z="-3451" chaotic="true" />
		<respawnPoint x="49033" y="184647" z="-3451" chaotic="true" />
		<respawnPoint x="49372" y="185076" z="-3451" chaotic="true" />
		<map X="20" Y="24" />
		<map X="21" Y="24" />
		<map X="21" Y="25" />
	</region>
</list>