<?xml version="1.0" encoding="UTF-8"?>

<list enabled="true" xmlns:xsi="http://www.w3.org/2001/XMLSchema-instance"
	  xmlns="http://l2j.org"
	  xsi:schemaLocation="http://l2j.org MapRegion.xsd">
	<!-- Rift Bitween Worlds -->
	<region name="rift_bitween_worlds" town="Dimensional Rift" locId="1643" bbs="100">
		<respawnPoint x="146950" y="26754" z="-2198" />
		<respawnPoint x="136398" y="28901" z="-3582" isChaotic="true" />
		<respawnPoint x="137292" y="28485" z="-3290" isChaotic="true" />
		<respawnPoint x="155925" y="28554" z="-3164" isChaotic="true" />
		<respawnPoint x="157608" y="23866" z="-3760" isChaotic="true" />
		<respawnPoint x="157463" y="28770" z="-3371" isChaotic="true" />
		<respawnPoint x="159348" y="28561" z="-3400" isChaotic="true" />
		<respawnPoint x="160236" y="14119" z="-3892" isChaotic="true" />
		<respawnPoint x="156764" y="13774" z="-3960" isChaotic="true" />
		<respawnPoint x="161426" y="23055" z="-3670" isChaotic="true" />
		<respawnPoint x="136380" y="21899" z="-3647" isChaotic="true" />
		<respawnPoint x="137708" y="15640" z="-3800" isChaotic="true" />
		<respawnPoint x="136629" y="28127" z="-3258" isChaotic="true" />
		<map X="16" Y="12" />
	</region>
</list>