<?xml version="1.0" encoding="UTF-8"?>
<!-- TODO: Remove "castle" attributes from here, it should be loaded from TaxZones -->
<list enabled="true" xmlns:xsi="http://www.w3.org/2001/XMLSchema-instance"
      xmlns="http://l2j.org"
      xsi:schemaLocation="http://l2j.org MapRegion.xsd">
	<!-- Elf Town -->
	<region name="elf_town" town="Elven Town" castle="4" locId="914" bbs="4">
		<respawnPoint x="45487" y="49767" z="-2950" />
		<respawnPoint x="45080" y="49614" z="-2950" />
		<respawnPoint x="45284" y="49309" z="-2950" />
		<respawnPoint x="45576" y="49412" z="-2950" />
		<respawnPoint x="45896" y="49831" z="-2950" />
		<respawnPoint x="45463" y="50097" z="-2950" />
		<respawnPoint x="44935" y="49798" z="-2950" />
		<respawnPoint x="44798" y="49475" z="-2950" />
		<respawnPoint x="45100" y="49025" z="-2950" />
		<respawnPoint x="45912" y="49363" z="-2950" />
		<respawnPoint x="45788" y="49861" z="-2950" />
		<respawnPoint x="45325" y="50067" z="-2950" />
		<respawnPoint x="40720" y="56064" z="-3580" isChaotic="true" />
		<respawnPoint x="39760" y="55040" z="-3410" isChaotic="true" />
		<respawnPoint x="43152" y="55920" z="-3620" isChaotic="true" />
		<respawnPoint x="44192" y="56960" z="-3580" isChaotic="true" />
		<respawnPoint x="39328" y="56256" z="-3580" isChaotic="true" />
		<respawnPoint x="40448" y="57744" z="-3600" isChaotic="true" />
		<respawnPoint x="38080" y="52048" z="-3500" isChaotic="true" />
		<respawnPoint x="38784" y="51824" z="-3470" isChaotic="true" />
		<respawnPoint x="37088" y="51248" z="-3400" isChaotic="true" />
		<respawnPoint x="37952" y="49680" z="-3480" isChaotic="true" />
		<respawnPoint x="38848" y="47072" z="-3580" isChaotic="true" />
		<respawnPoint x="36688" y="49856" z="-3440" isChaotic="true" />
		<respawnPoint x="36096" y="46544" z="-3680" isChaotic="true" />
		<respawnPoint x="37200" y="45232" z="-3600" isChaotic="true" />
		<respawnPoint x="50128" y="55472" z="-3410" isChaotic="true" />
		<respawnPoint x="51856" y="54432" z="-3320" isChaotic="true" />
		<respawnPoint x="53136" y="54592" z="-3420" isChaotic="true" />
		<respawnPoint x="51824" y="58624" z="-3400" isChaotic="true" />
		<respawnPoint x="51232" y="59216" z="-3320" isChaotic="true" />
		<respawnPoint x="49808" y="56240" z="-3430" isChaotic="true" />
		<map X="21" Y="19" />
		<map X="21" Y="20" />
		<map X="20" Y="19" />
		<map X="20" Y="20" />
		<banned race="DARK_ELF" point="darkelf_town" />
	</region>
	<!-- Mothertree Glade -->
	<region name="Mothertree_Glade" town="Elven Town" castle="4" locId="914" bbs="4">
		<respawnPoint x="46045" y="41251" z="-3440" />
		<respawnPoint x="46117" y="41247" z="-3440" />
		<respawnPoint x="46182" y="41198" z="-3440" />
		<respawnPoint x="46115" y="41141" z="-3440" />
		<respawnPoint x="46048" y="41141" z="-3440" />
		<respawnPoint x="45978" y="41196" z="-3440" />
		<respawnPoint x="40720" y="56064" z="-3580" isChaotic="true" />
		<respawnPoint x="39760" y="55040" z="-3410" isChaotic="true" />
		<respawnPoint x="43152" y="55920" z="-3620" isChaotic="true" />
		<respawnPoint x="44192" y="56960" z="-3580" isChaotic="true" />
		<respawnPoint x="39328" y="56256" z="-3580" isChaotic="true" />
		<respawnPoint x="40448" y="57744" z="-3600" isChaotic="true" />
		<respawnPoint x="38080" y="52048" z="-3500" isChaotic="true" />
		<respawnPoint x="38784" y="51824" z="-3470" isChaotic="true" />
		<respawnPoint x="37088" y="51248" z="-3400" isChaotic="true" />
		<respawnPoint x="37952" y="49680" z="-3480" isChaotic="true" />
		<respawnPoint x="38848" y="47072" z="-3580" isChaotic="true" />
		<respawnPoint x="36688" y="49856" z="-3440" isChaotic="true" />
		<respawnPoint x="36096" y="46544" z="-3680" isChaotic="true" />
		<respawnPoint x="37200" y="45232" z="-3600" isChaotic="true" />
		<respawnPoint x="50128" y="55472" z="-3410" isChaotic="true" />
		<respawnPoint x="51856" y="54432" z="-3320" isChaotic="true" />
		<respawnPoint x="53136" y="54592" z="-3420" isChaotic="true" />
		<respawnPoint x="51824" y="58624" z="-3400" isChaotic="true" />
		<respawnPoint x="51232" y="59216" z="-3320" isChaotic="true" />
		<respawnPoint x="49808" y="56240" z="-3430" isChaotic="true" />
		<banned race="DARK_ELF" point="darkelf_town" />
	</region>
</list>