<?xml version="1.0" encoding="UTF-8"?>

<list enabled="true" xmlns:xsi="http://www.w3.org/2001/XMLSchema-instance"
	  xmlns="http://l2j.org"
	  xsi:schemaLocation="http://l2j.org MapRegion.xsd">
	<!-- Orc Town -->
	<region name="orc_town" town="Orc Town" locId="920" bbs="9">
		<respawnPoint x="-44316" y="-113136" z="-80" />
		<respawnPoint x="-44296" y="-114048" z="-80" />
		<respawnPoint x="-44704" y="-112896" z="-80" />
		<respawnPoint x="-44720" y="-114304" z="-80" />
		<respawnPoint x="-44206" y="-113392" z="-80" />
		<respawnPoint x="-43970" y="-114150" z="-80" />
		<respawnPoint x="-44328" y="-114625" z="-80" />
		<respawnPoint x="-44884" y="-115063" z="-80" />
		<respawnPoint x="-44923" y="-114659" z="-80" />
		<respawnPoint x="-44232" y="-113701" z="-80" />
		<respawnPoint x="-44596" y="-112956" z="-80" />
		<respawnPoint x="-44987" y="-112394" z="-80" />
		<respawnPoint x="-45498" y="-111800" z="-80" />
		<respawnPoint x="-44637" y="-112373" z="-80" />
		<respawnPoint x="-44189" y="-113065" z="-80" />
		<respawnPoint x="-44048" y="-113463" z="-80" />
		<respawnPoint x="-43552" y="-121488" z="-233" isChaotic="true" />
		<respawnPoint x="-42560" y="-121344" z="-188" isChaotic="true" />
		<respawnPoint x="-41536" y="-122960" z="-308" isChaotic="true" />
		<respawnPoint x="-40464" y="-122752" z="-364" isChaotic="true" />
		<respawnPoint x="-45568" y="-107296" z="-516" isChaotic="true" />
		<respawnPoint x="-46512" y="-106032" z="-700" isChaotic="true" />
		<respawnPoint x="-44304" y="-105888" z="-1156" isChaotic="true" />
		<respawnPoint x="-43728" y="-106688" z="-1304" isChaotic="true" />
		<respawnPoint x="-40000" y="-109200" z="-1736" isChaotic="true" />
		<respawnPoint x="-39792" y="-110832" z="-1860" isChaotic="true" />
		<respawnPoint x="-39136" y="-112688" z="-1844" isChaotic="true" />
		<respawnPoint x="-37888" y="-112608" z="-1772" isChaotic="true" />
		<map X="18" Y="14" />
		<map X="19" Y="13" />
		<map X="19" Y="14" />
		<map X="19" Y="15" />
		<map X="19" Y="16" />
		<map X="20" Y="13" />
		<map X="20" Y="14" />
		<map X="20" Y="15" />
	</region>
	<!-- Temple Of Paagrio -->
	<region name="Temple_of_Paagrio" town="Orc Town" locId="920" bbs="9">
		<respawnPoint x="-56733" y="-113459" z="-690" />
		<respawnPoint x="-56686" y="-113470" z="-690" />
		<respawnPoint x="-56728" y="-113610" z="-690" />
		<respawnPoint x="-56693" y="-113610" z="-690" />
		<respawnPoint x="-56743" y="-113757" z="-690" />
		<respawnPoint x="-56682" y="-113730" z="-690" />
		<respawnPoint x="-43552" y="-121488" z="-233" isChaotic="true" />
		<respawnPoint x="-42560" y="-121344" z="-188" isChaotic="true" />
		<respawnPoint x="-41536" y="-122960" z="-308" isChaotic="true" />
		<respawnPoint x="-40464" y="-122752" z="-364" isChaotic="true" />
		<respawnPoint x="-45568" y="-107296" z="-516" isChaotic="true" />
		<respawnPoint x="-46512" y="-106032" z="-700" isChaotic="true" />
		<respawnPoint x="-44304" y="-105888" z="-1156" isChaotic="true" />
		<respawnPoint x="-43728" y="-106688" z="-1304" isChaotic="true" />
		<respawnPoint x="-40000" y="-109200" z="-1736" isChaotic="true" />
		<respawnPoint x="-39792" y="-110832" z="-1860" isChaotic="true" />
		<respawnPoint x="-39136" y="-112688" z="-1844" isChaotic="true" />
		<respawnPoint x="-37888" y="-112608" z="-1772" isChaotic="true" />
	</region>
</list>